Row Index*,Statement,Option 1,Rep 1,Option 1 Row Index,Option 2,Rep 2,Option 2 Row Index,Option 3,Rep 3,Option 3 Row Index,Option 4,Rep 4,Option 4 Row Index
0, , ,0,0, ,0,0, ,0,0, ,0,0
1, , ,0,0, ,0,0, ,0,0, ,0,0
2,What do you want?, Just looking around,0,0, Survey sent me,0,3, Medium sent me,0,3, ,0,0
3,"I don't know anybody by that name."," Ok, I will get out of your way.",0,5, They said you could help.,0,4, ,0,0, ,0,0
4,"Did they now.  Looks like I found the rebels.  Guards, guards, over here.", ,0,0, ,0,0, ,0,0, ,0,0
5,"'Quietly leaning over, ', you looking dor the arc?", "Yes, but I couldn't find the data." ,0,6, "Yes, do you know where the exit is?",0,7, "Who me!  No, not at all." ,0,0, ,0,0
6,"I can't help you with that.", Ok,0,0, But you know where the exit is?,0,7, ,0,0, ,0,0
7,"Yes, go back to the bridge, but keep walking.  You'll see it when you get close." ,  Thank you. You were so helpful.,0,0,  OK.,0,0, ",0,8, ,0,0